{
  "$schema": "https://json-schema.org/draft/2020-12/schema",
  "$id": "https://metheus.castalia.institute/schema/assembled-reading.schema.json",
  "title": "Metheus assembled reading package",
  "description": "Validated deterministic presentation package. Validation checks structure and provenance links, not whether authored text is entailed by sources.",
  "type": "object",
  "additionalProperties": false,
  "required": ["assembled", "readingId", "subjectId", "version", "purpose", "question", "timeWindow", "claims", "limitations", "assembly"],
  "properties": {
    "assembled": { "const": true },
    "readingId": { "type": "string", "minLength": 1 },
    "subjectId": { "type": "string", "minLength": 1 },
    "version": { "type": "string", "minLength": 1 },
    "purpose": { "enum": ["symbolic_calculation", "personal_reflection", "rhythm_summary", "learning_support", "health_record_organization", "caregiver_coordination", "clinical_sharing", "other"] },
    "question": { "type": "string", "minLength": 1 },
    "timeWindow": { "$ref": "#/$defs/timeWindow" },
    "claims": {
      "type": "array",
      "items": {
        "type": "object",
        "additionalProperties": false,
        "required": ["position", "claimType", "text", "sourceIds", "sources", "phaseAnnotations", "references", "support"],
        "properties": {
          "position": { "type": "integer", "minimum": 1 },
          "claimType": { "enum": ["observation", "estimate", "symbolic_prompt", "interpretive_question", "hypothesis", "boundary"] },
          "text": { "type": "string", "minLength": 1 },
          "sourceIds": { "type": "array", "items": { "type": "string", "minLength": 1 }, "uniqueItems": true },
          "sources": { "type": "array", "items": { "$ref": "#/$defs/source" } },
          "phaseAnnotations": { "type": "array", "items": { "$ref": "#/$defs/phaseAnnotation" } },
          "references": { "type": "array", "items": { "$ref": "#/$defs/reference" } },
          "support": { "$ref": "#/$defs/support" }
        }
      }
    },
    "limitations": { "type": "array", "items": { "type": "string" } },
    "assembly": {
      "type": "object",
      "additionalProperties": false,
      "required": ["kind", "sourceTextGenerated", "textEntailmentVerified", "inputSchemasValidated", "outputSchemaValidated", "authorizedAction"],
      "properties": {
        "kind": { "const": "deterministic_claim_assembly" },
        "sourceTextGenerated": { "const": false },
        "textEntailmentVerified": { "const": false },
        "inputSchemasValidated": { "const": true },
        "outputSchemaValidated": { "const": true },
        "authorizedAction": { "enum": ["analyze", "remote_processing"] }
      }
    }
  },
  "$defs": {
    "timeWindow": {
      "type": "object",
      "additionalProperties": false,
      "required": ["start", "end", "precision"],
      "properties": {
        "start": { "type": "string", "format": "date-time" },
        "end": { "type": "string", "format": "date-time" },
        "timeZone": { "type": "string" },
        "precision": { "enum": ["exact", "approximate", "date_only"] }
      }
    },
    "support": {
      "type": "object",
      "additionalProperties": false,
      "required": ["confidence", "coverage"],
      "properties": {
        "confidence": { "enum": ["high", "moderate", "low", "not_applicable"] },
        "coverage": { "enum": ["adequate", "partial", "sparse", "unknown"] },
        "rationale": { "type": "string" },
        "alternatives": { "type": "array", "items": { "type": "string" } }
      }
    },
    "source": {
      "type": "object",
      "required": ["id", "recordType"],
      "properties": {
        "id": { "type": "string", "minLength": 1 },
        "recordType": { "type": "string", "minLength": 1 },
        "derivedSummary": { "type": "object" }
      },
      "additionalProperties": true
    },
    "phaseAnnotation": {
      "type": "object",
      "additionalProperties": false,
      "required": ["id", "layer", "phaseSystem", "canonicalPhase", "window", "basis", "interpretation", "basisRecordIds", "method", "uncertainty", "limitations"],
      "properties": {
        "id": { "type": "string", "minLength": 1 },
        "layer": { "enum": ["promethean", "epimethean"] },
        "phaseSystem": { "enum": ["human_design_transit", "astrological_transit", "menstrual_cycle", "pregnancy", "postpartum", "menopause", "development", "sleep_wake", "other"] },
        "canonicalPhase": { "type": "string", "minLength": 1 },
        "evocativeName": { "type": "string", "minLength": 1 },
        "description": { "type": "string" },
        "window": { "type": "object" },
        "basis": { "enum": ["reported", "observed", "derived", "clinically_assessed"] },
        "interpretation": { "enum": ["descriptive", "symbolic", "reflective"] },
        "sourceSystem": { "type": "object" },
        "nameSource": { "enum": ["metheus_suggestion", "user_authored", "source_attributed"] },
        "basisRecordIds": { "type": "array", "items": { "type": "string" } },
        "method": { "type": "string", "minLength": 1 },
        "methodVersion": { "type": "string" },
        "uncertainty": { "type": "string", "minLength": 1 },
        "limitations": { "type": "array", "items": { "type": "string" } },
        "supersedes": { "type": "string", "minLength": 1 }
      }
    },
    "reference": {
      "type": "object",
      "additionalProperties": false,
      "required": ["id", "kind", "sourceCitations", "limitations"],
      "properties": {
        "id": { "type": "string", "minLength": 1 },
        "kind": { "enum": ["correspondence", "evidence_claim"] },
        "claimText": { "type": "string", "minLength": 1 },
        "evidenceStatus": { "type": "string" },
        "scope": {
          "type": "object",
          "additionalProperties": false,
          "required": ["description"],
          "properties": {
            "description": { "type": "string", "minLength": 1 },
            "population": { "type": "string" },
            "setting": { "type": "string" },
            "exposureOrSignal": { "type": "string" },
            "routeOrSpecimen": { "type": "string" },
            "comparator": { "type": "string" },
            "outcome": { "type": "string" },
            "timeframe": { "type": "string" }
          }
        },
        "sourceCitations": { "type": "array" },
        "limitations": { "type": "array", "items": { "type": "string" } }
      }
    }
  }
}
