{
  "assembled": true,
  "readingId": "synthetic-measurement-series-reading",
  "subjectId": "measurement-series-example-subject",
  "version": "0.1",
  "purpose": "rhythm_summary",
  "question": "Show how a selected synthetic numeric series is represented over its window.",
  "timeWindow": {
    "start": "2026-10-18T00:00:00Z",
    "end": "2026-10-20T00:00:00Z",
    "timeZone": "Etc/UTC",
    "precision": "exact"
  },
  "claims": [
    {
      "position": 1,
      "claimType": "observation",
      "text": "This synthetic reading carries a descriptive summary of the selected heart-rate records.",
      "sourceIds": [
        "measurement-series:metheus-numeric-measurement-series/0.3.0:2026-10-18:2026-10-19:7:synthetic"
      ],
      "sources": [
        {
          "id": "measurement-series:metheus-numeric-measurement-series/0.3.0:2026-10-18:2026-10-19:7:synthetic",
          "recordType": "rhythm_summary",
          "domain": "physiology",
          "label": "descriptive series for heart_rate (beats/min)",
          "epistemicClass": "derived",
          "schemaVersion": "0.1",
          "summaryType": "derived_rhythm_summary",
          "summaryMeasure": "measurement_series",
          "methodVersion": "metheus-numeric-measurement-series/0.3.0",
          "window": {
            "startDate": "2026-10-18",
            "endDate": "2026-10-19",
            "inclusiveDays": 2
          },
          "inputRecordIds": [
            "measurement-series-2026-10-18",
            "measurement-series-2026-10-19"
          ],
          "derivedSummary": {
            "methodVersion": "metheus-numeric-measurement-series/0.3.0",
            "revisionResolution": {
              "strategy": "latest_visible_successor",
              "supersededRecordCount": 0,
              "unresolvedPredecessorCount": 0
            },
            "window": {
              "startDate": "2026-10-18",
              "endDate": "2026-10-19",
              "inclusiveDays": 2
            },
            "inputRecordIds": [
              "measurement-series-2026-10-18",
              "measurement-series-2026-10-19"
            ],
            "measurementSeries": {
              "analyteOrSignal": "heart_rate",
              "unit": "beats/min",
              "epistemicClass": "imported",
              "sourceKind": "external_import",
              "sourceName": "synthetic wearable export",
              "sourceMethod": "device-exported heart-rate field",
              "sourceVersion": "1",
              "methodDetails": "unspecified",
              "specimen": "unspecified",
              "sensorLocation": "wrist",
              "deviceOrAssay": "synthetic wearable",
              "deviceModel": "Example 1",
              "algorithmVersion": "1",
              "collectionConditions": "resting; synthetic"
            },
            "nMeasurements": 2,
            "nDistinctMeasurementDates": 2,
            "medianNumericValue": 71,
            "medianAbsoluteDeviationValue": 1,
            "minimumValue": 70,
            "maximumValue": 72,
            "recordsWithQualityFlags": 0,
            "qualityFlags": [],
            "coverage": {
              "daysWithAtLeastOneRecord": 2,
              "calendarDaysInWindow": 2,
              "fractionOfDaysWithARecord": 1
            },
            "limitations": [
              "Synthetic descriptive example only; it is not a clinical reference or person's baseline.",
              "The summary does not infer hormone or neurochemical state, trend, cause, or recommended action.",
              "Fixed-width date buckets anchored to the selected start date are descriptive and do not estimate a trend or personal baseline."
            ],
            "bucketDays": 7,
            "timeBuckets": [
              {
                "startDate": "2026-10-18",
                "endDate": "2026-10-19",
                "inclusiveDays": 2,
                "inputRecordIds": [
                  "measurement-series-2026-10-18",
                  "measurement-series-2026-10-19"
                ],
                "nMeasurements": 2,
                "nDistinctMeasurementDates": 2,
                "medianValue": 71,
                "medianAbsoluteDeviationValue": 1,
                "minimumValue": 70,
                "maximumValue": 72,
                "recordsWithQualityFlags": 0,
                "qualityFlags": [],
                "daysWithAtLeastOneRecord": 2,
                "fractionOfDaysWithARecord": 1,
                "uncertaintyMetadata": {
                  "recordsWithUncertaintyObject": 0,
                  "levelCounts": {
                    "low": 0,
                    "moderate": 0,
                    "high": 0,
                    "unknown": 0,
                    "not_reported": 2
                  }
                }
              }
            ],
            "uncertaintyMetadata": {
              "recordsWithUncertaintyObject": 0,
              "levelCounts": {
                "low": 0,
                "moderate": 0,
                "high": 0,
                "unknown": 0,
                "not_reported": 2
              }
            }
          }
        }
      ],
      "phaseAnnotations": [],
      "references": [],
      "support": {
        "confidence": "moderate",
        "coverage": "partial",
        "rationale": "Synthetic example with two records over two dates."
      }
    }
  ],
  "limitations": [
    "Synthetic example only. Bucket summaries describe logged values and do not establish a trend, hormone state, clinical range, or cause."
  ],
  "assembly": {
    "kind": "deterministic_claim_assembly",
    "sourceTextGenerated": false,
    "textEntailmentVerified": false,
    "inputSchemasValidated": true,
    "outputSchemaValidated": true,
    "authorizedAction": "analyze"
  }
}
